product_name,country,wine_type,short_description,rating,reviews,price_per_bottle,quantity,actual_price,after_discount_price,saving_amount
Le Champ des Etoiles Chardonnay 2024 ,France,Chardonnay,Barrel-Aged French Chardonnay,,145 Reviews,$21.99 per bottle,12 bottles - $263.88,,,
Dominio de Los Duques Cava  ,Spain,Macabeo-based blend,Exclusive Spanish Sparkles,,17 Reviews,$16.99 per bottle,12 bottles - $203.88,,,
HJ Fabre Gran Reserva Malbec 2022 ,Argentina,Malbec,Star Winemaker’s Gran Reserva Malbec,,109 Reviews,$34.99 per bottle,12 bottles - $419.88,,,
¡Hola! Desde Barcelona Reserva NV ,Spain,White blend,Top-Quality Spanish Sparkler,,,$28.99 per bottle,12 bottles - $347.88,,,
Bariloche Malbec 2023 ,Argentina,Malbec,Roaring Good Argentine Malbec,,27 Reviews,$18.99 per bottle,6 bottles - $113.94,$113.94,$89.94,Save $24.00
Il Poeta Chardonnay 2024 ,Italy,Chardonnay,Elegant Piedmont Chardonnay,,,$24.99 per bottle,12 bottles - $299.88,,,
Sendero das Meigas Albariño 2020 ,Spain,Albariño,Gold-Medal Albariño,,20 Reviews,$21.99 per bottle,12 bottles - $263.88,,,
Cabalié Rosé 2024 ,France,Grenache-based blend,Mouthwatering French Rosé,,3 Reviews,$17.99 per bottle,12 bottles - $215.88,,,
Yarrunga Field Special Reserve White 2024 ,Australia,White blend,Sunshine-in-a-Glass from Australia,,138 Reviews,$15.99 per bottle,12 bottles - $191.88,,,
Altos de la Guardia Selección de Familia Rioja 2014 ,Spain,Tempranillo,Rare Rioja Library Release,,1 Review,$29.99 per bottle,12 bottles - $359.88,,,
Amandla Sauvignon Blanc 2024 ,South Africa,Sauvignon Blanc,Wine of Show Winner at Our NYC Tasting 2025,,13 Reviews,$19.99 per bottle,12 bottles - $239.88,,,
Al Hirschfeld Petite Sirah 2021 ,United States,Petite Sirah,Scene-Stealing California Petite Sirah,,3 Reviews,$17.99 per bottle,12 bottles - $215.88,,,
L'Epiphanie de Bordeaux Blanc 2021 ,France,Sauvignon Blanc,Insiders-Only White Bordeaux,,2 Reviews,$49.99 per bottle,12 bottles - $599.88,,,
Le Malbec d’Hervé 2021 ,France,Malbec,Rich French Malbec,,73 Reviews,$15.99 per bottle,12 bottles - $191.88,,,
Late Arrival Carignane 2021 ,United States,Carignan,Rare Lodi Carignane,,8 Reviews,$21.99 per bottle,12 bottles - $263.88,,,
Bartolomeo Lorenzi Amarone 2020 ,Italy,Red blend,Fine Amarone from Pioneering Winery,,25 Reviews,$59.99 per bottle,12 bottles - $719.88,,,
The Gooseberry Bush 2024 ,South Africa,Colombard,South African Thirst Quencher,,215 Reviews,$14.99 per bottle,12 bottles - $179.88,,,
GFF Petite Sirah 2023 ,United States,Petite Sirah,Family-Made California Red,,8 Reviews,$19.99 per bottle,12 bottles - $239.88,,,
Camera Obscura Petit Verdot 2023 ,United States,Petit Verdot,"Deep, Dark California Petit Verdot",,8 Reviews,$21.99 per bottle,12 bottles - $263.88,,,
Left of Ordinary Tannat 2023 ,United States,Tannat,Best-in-Glass California Tannat,,18 Reviews,$21.99 per bottle,12 bottles - $263.88,,,
Thick Skin Cabernet Sauvignon 2022 ,United States,Cabernet Sauvignon,Bold Gold-Medal California Cabernet,,49 Reviews,$21.99 per bottle,12 bottles - $263.88,,,
Prezza Prosecco Rosé 2021 ,Italy,Glera,Top-Estate Prosecco Rosé,,10 Reviews,$21.99 per bottle,12 bottles - $263.88,,,
KAPA Cabernet Sauvignon 2022 ,United States,Cabernet Sauvignon,Gold-Medal California Cabernet,,35 Reviews,$21.99 per bottle,12 bottles - $263.88,,,
Château La Clarière Blanc 2023 ,France,Sauvignon-based blend,Classy White Bordeaux,,11 Reviews,$34.99 per bottle,12 bottles - $419.88,,,
Henry Greuzard Mâcon la Roche Vineuse Vieilles Vignes 2021 ,France,Chardonnay,Old-Vine Burgundy,,29 Reviews,$26.99 per bottle,12 bottles - $323.88,,,
Wild Child Chardonnay 2024 ,South Africa,Chardonnay,Refreshing South African Chardonnay,,94 Reviews,$21.99 per bottle,12 bottles - $263.88,,,
w/o Nero d'Avola Rosato 2024 ,Italy,Nero d'Avola,Organically Grown Sicilian Rosato,,3 Reviews,$19.99 per bottle,12 bottles - $239.88,,,
The Assist Cabernet Sauvignon 2023 ,United States,Cabernet Sauvignon,Triumphant California Cabernet,,93 Reviews,$19.99 per bottle,12 bottles - $239.88,,,
Lobo e Falcão Branco 2024 ,Portugal,Fernão Pires-based blend,Top-Estate Portuguese White,,123 Reviews,$19.99 per bottle,12 bottles - $239.88,,,
Brightwater Nelson Sauvignon Blanc 2023 ,New Zealand,Sauvignon Blanc,Thrilling New Zealand Sauvignon Blanc,,27 Reviews,$26.99 per bottle,12 bottles - $323.88,,,
Julien Bouchard Bourgogne Côte d'Or Pinot Noir 2022 ,France,Pinot Noir,The Best of Burgundy,,1 Review,$39.99 per bottle,12 bottles - $479.88,,,
Book of the Day Pinot Noir 2023 ,United States,Pinot Noir,Lush California Pinot Noir,,1 Review,$23.99 per bottle,12 bottles - $287.88,,,
Lustrum Petite Sirah 2023 ,United States,Petite Sirah,"Petite Sirah, BIG flavor",,8 Reviews,$18.99 per bottle,12 bottles - $227.88,,,
Ticking Clock White Blend 2023 ,United States,White blend,Delicious Lodi Discovery,,10 Reviews,$21.99 per bottle,12 bottles - $263.88,,,
Le Malbec d’Hervé 2024 ,France,Malbec,Rich Southern French Malbec,,73 Reviews,$17.99 per bottle,12 bottles - $215.88,,,
Cabalié Origine 2023 ,France,Red blend,The Ultimate Cabalié,,24 Reviews,$28.99 per bottle,12 bottles - $347.88,,,
Edenvale Sparkling Cuvée NV ,Australia,Sémillon,"90-Point, No-Alcohol Bubbly",,5 Reviews,$19.99 per bottle,12 bottles - $239.88,,,
Terra di Nonno Vermentino 2023 ,Italy,Vermentino,Historic Sicilian Vermentino,,57 Reviews,$16.99 per bottle,12 bottles - $203.88,,,
Saracosa Vermentino 2023 ,Italy,Vermentino,Top-Estate Tuscan Vermentino,,142 Reviews,$22.99 per bottle,12 bottles - $275.88,,,
Grande Réserve de Gassac Blanc 2023 ,France,White blend,Iconic French Estate’s Grande Réserve,,291 Reviews,$21.99 per bottle,12 bottles - $263.88,,,
Stand-Out Champagne Six  ,,,50% Off Six Bottles of Fine Champagne,,,,6 bottles - $344.94,$344.94,$172.47,Save $172.47
Vale de Rosas Pinot Noir 2022 ,Portugal,Pinot Noir,Top-Estate Portuguese Pinot Noir,,15 Reviews,$16.99 per bottle,12 bottles - $203.88,,,
The American LGBTQ+ Pride Blend Red Wine 2020 ,United States,Cabernet-based blend,Vibrant Red With a Cause,,1 Review,$49.99 per bottle,12 bottles - $599.88,$599.88,$419.88,Save $180.00
La Chiamata Montepulciano Riserva 2018 ,Italy,Montepulciano,Montepulciano Riserva Rarity,,3 Reviews,$24.99 per bottle,12 bottles - $299.88,,,
Baronesa de Vilar LBV Port (50cl) 2019 ,Portugal,Touriga Nacional-based blend,Bold Late-Bottled Vintage Port,,1 Review,$29.99 per bottle,3 bottles - $89.97,$89.97,$59.97,Save $30.00
Julien Bouchard Chablis 2023 ,France,Chardonnay,Textbook Chablis,,,$34.99 per bottle,12 bottles - $419.88,,,
On The Line Chenin Blanc 2023 ,United States,Chenin Blanc,Cool and Collected Cali Chenin,,12 Reviews,$24.99 per bottle,12 bottles - $299.88,,,
RedHeads Harmonie Rox Chardonnay 2024 ,Australia,Chardonnay,Vibrant Australian Chardonnay,,9 Reviews,$24.99 per bottle,12 bottles - $299.88,,,
Violette de Mireval 2023 ,France,Négrette,Gold-Medal French Rosé,,9 Reviews,$17.99 per bottle,12 bottles - $215.88,,,
Les Chemins de l Abbaye 2021 ,France,Sauvignon Blanc,Premium Pouilly-Fumé,,14 Reviews,$33.99 per bottle,12 bottles - $407.88,$407.88,$325.88,Save $82.00
Belle Roche Cabernet Sauvignon 2023 ,France,Cabernet Sauvignon,Stylish French Cabernet,,421 Reviews,$19.99 per bottle,12 bottles - $239.88,,,
Château La Clarière 2022 ,France,Merlot-based blend,Multi-Gold 2022 Bordeaux,,22 Reviews,$39.99 per bottle,12 bottles - $479.88,,,
Champagne Nicolo et Paradis Brut Prestige NV ,France,Chardonnay-based blend,Limited-Edition Champagne Release,,,$69.99 per bottle,12 bottles - $839.88,,,
It's a Wonderful Life Red Blend 2021 ,United States,Red blend,Heartwarming California Red,,4 Reviews,$18.99 per bottle,12 bottles - $227.88,,,
Avera Touriga Nacional 2020 ,United States,Touriga Nacional,93-Point Rare California Touriga Nacional,,20 Reviews,$23.99 per bottle,12 bottles - $287.88,,,
TCM Summer Under the Stars 2021 ,United States,Chardonnay,Summer-in-a-Glass California Chardonnay,,6 Reviews,$19.99 per bottle,12 bottles - $239.88,,,
L'Estabel Grande Cuvée Comtesse 2023 ,France,Cinsault,Elegant Southern French Rosé,,10 Reviews,$29.99 per bottle,12 bottles - $359.88,,,
w/o Frappato 2024 ,Italy,Frappato,Gold-Medal Organically Grown Sicilian Red,,44 Reviews,$19.99 per bottle,12 bottles - $239.88,,,
Chemin du Belvedère Blanc 2020 ,France,Marsanne,Elegant Rival to White Hermitage,,1 Review,$28.99 per bottle,12 bottles - $347.88,,,
Château Le Vieux Duché 2020 ,France,Merlot-based blend,Gold-Medal Lalande-de-Pomerol,,13 Reviews,$40.99 per bottle,12 bottles - $491.88,,,
KAPA Cabernet Sauvignon 2023 ,United States,Cabernet Sauvignon,Crowdpleasing California Cab,,35 Reviews,$21.99 per bottle,12 bottles - $263.88,,,
Selvarossa dei Confratelli Riserva 2021 ,Italy,Negroamaro-based blend,Insiders-Only Italian Riserva,,13 Reviews,$39.99 per bottle,12 bottles - $479.88,,,
Château La Clarière 2023 ,France,Merlot-based blend,91-Point Bordeaux,,23 Reviews,$39.99 per bottle,12 bottles - $479.88,,,
Tenuta Fenice Riserva 2022 ,Italy,Red blend,Old-Vine Sicilian Riserva,,,$26.99 per bottle,12 bottles - $323.88,,,
Flor de San Martín Garnacha Blanca 2023 ,Spain,Garnacha Blanca,Gold-Medal Spanish White Garnacha,,101 Reviews,$17.99 per bottle,12 bottles - $215.88,,,
Visionario 2024 ,Italy,White blend,Elegant Venetian White,,69 Reviews,$22.99 per bottle,12 bottles - $275.88,,,
Baronesa de Vilar Port Finish Reserva 2021 ,Portugal,Touriga Nacional-based blend,Sumptuous Reserva Aged in Port Barrels,,77 Reviews,$26.99 per bottle,12 bottles - $323.88,,,
Silver Puffs Sauvignon Blanc 2023 ,United States,Sauvignon Blanc,Tropical and Compelling California Sauvignon,,112 Reviews,$19.99 per bottle,12 bottles - $239.88,,,
Perfect Provence Rosé Wine 3-Bottle Gift Set  ,,,The Ultimate Gift for Rosé Lovers,,,,3 bottles - $79.97,$79.97,$59.99,Save $19.98
NPR Weekend Edition CA Red Blend 2024 ,United States,Red blend,Authoritative Red Blend,,1 Review,$20.99 per bottle,12 bottles - $251.88,,,
Il Picchio Verdicchio di Matelica 2023 ,Italy,Verdicchio,An Italian Classic,,,$22.99 per bottle,12 bottles - $275.88,,,
RedHeads Blue Belle Riesling 2024 ,Australia,Riesling,"Crisp, Dry Aussie Riesling",,,$28.99 per bottle,12 bottles - $347.88,,,
Bartolomeo Lorenzi Rosso Veronese 2022 ,Italy,Corvina-based blend,Acclaimed Valpolicella Red,,6 Reviews,$18.99 per bottle,12 bottles - $227.88,,,
Collezione di Paolo Chianti 2024 ,Italy,Sangiovese,Top Winemaker’s Signature Chianti,,616 Reviews,$19.99 per bottle,12 bottles - $239.88,,,
Nicolo & Paradis Champagne Trio  ,,,Fine Champagne—Three for Two Deal,,,,3 bottles - $149.97,$149.97,$99.97,Save $50.00
Lost Isle Cabernet Sauvignon Clarksburg 2024 ,United States,Cabernet Sauvignon,Esteemed California Cabernet,,,$22.99 per bottle,12 bottles - $275.88,$275.88,$191.88,Save $84.00
Green Darner Riesling 2023 ,United States,Riesling,Alluring Washington Riesling,,4 Reviews,$24.99 per bottle,12 bottles - $299.88,,,
El Mojón 2023 ,Spain,Tempranillo-based blend,"92-Point, Barrel-Aged Spanish Red",,2 Reviews,$24.99 per bottle,12 bottles - $299.88,,,
Villa Broglia Gavi di Gavi Anniversario 2022 ,Italy,Cortese,Top-Estate 90+ Point Release,,,$32.99 per bottle,12 bottles - $395.88,,,
Cossaro Monferrato Nebbiolo 2023 ,Italy,Nebbiolo,Top-Estate Piedmont Nebbiolo,,4 Reviews,$27.99 per bottle,12 bottles - $335.88,,,
Lobster Shack Sauvignon Blanc 2024 ,South Africa,Sauvignon Blanc,Thrilling Sauvignon Blanc,,26 Reviews,$15.99 per bottle,12 bottles - $191.88,,,
Villa Pani Brachetto (500ml) 2020 ,Italy,Brachetto,Italy’s Sweet Red Treasure,,4 Reviews,$18.99 per bottle,12 bottles - $227.88,,,
Subbia Antica Brunello di Montalcino 2015 ,Italy,Sangiovese,94-Point Brunello,,7 Reviews,$54.99 per bottle,12 bottles - $659.88,$659.88,$560.88,Save $99.00
Cabalié Blanc 2023 ,France,Viognier-based blend,Acclaimed Southern French White,,103 Reviews,$17.99 per bottle,12 bottles - $215.88,,,
Altos de la Guardia Crianza Rioja 2021 ,Spain,Tempranillo,"91-Point, Gold-Medal Rioja",,241 Reviews,$25.99 per bottle,12 bottles - $311.88,,,
Collezione di Paolo Poggerissi 2024 ,Italy,Sangiovese,Elegant Tuscan Sangiovese,,46 Reviews,$15.99 per bottle,12 bottles - $191.88,,,
The Magpie Oakville Cabernet Sauvignon 2023 ,United States,Cabernet Sauvignon,Top-Secret Napa Cabernet Sauvignon,,,$89.99 per bottle,12 bottles - $1079.88,,,
Robert Ledoux Bourgogne Aligoté 2022 ,France,Aligoté,Lively Aligoté,,,$24.99 per bottle,12 bottles - $299.88,,,
Château Vieil Orme 2020 ,France,Cabernet-based blend,Classic Mature Bordeaux,,1 Review,$24.99 per bottle,12 bottles - $299.88,,,
Drawbridge Reserve Cabernet Sauvignon 2023 ,United States,Cabernet Sauvignon,Oak-Aged California Cabernet,,6 Reviews,$24.99 per bottle,12 bottles - $299.88,,,
Amandla Shiraz Zinfandel 2023 ,South Africa,Shiraz-based blend,Powerful South African Shiraz-Zin,,11 Reviews,$19.99 per bottle,12 bottles - $239.88,,,
Wings Cabernet Franc 2020 ,United States,Cabernet Franc,Historic California Cabernet Franc,,4 Reviews,$21.99 per bottle,12 bottles - $263.88,,,
La Cueva Cabernet Sauvignon 2024 ,Spain,Cabernet Sauvignon,Spanish Cabernet,,7 Reviews,$16.99 per bottle,12 bottles - $203.88,,,
Domaine B&B Bouché Crémant de Limoux Rosé NV ,France,Chardonnay-based blend,Boutique French Sparkling Rosé,,32 Reviews,$27.99 per bottle,12 bottles - $335.88,,,
Portinho do Côvo 2023 ,Portugal,Red blend,Star Winemaker’s Portuguese Red,,138 Reviews,$16.99 per bottle,12 bottles - $203.88,,,
Schroeder Estate Cabernet Sauvignon 2023 ,Argentina,Cabernet Sauvignon,Extrermely Good Cab from the Extreme South,,396 Reviews,$21.99 per bottle,12 bottles - $263.88,,,
Toast Worthy Tuscan Reds & Whites  ,,,A Toast to Tuscany—Save Over $80,,,,12 bottles - $286.88,$286.88,$199.88,Save $87.00
Château Le Coin Bordeaux 2023 ,France,Merlot-based blend,Classic Dark-Fruited Bordeaux,,6 Reviews,$22.99 per bottle,12 bottles - $275.88,,,
HJ Fabre Assemblage Cabernet Franc Cabernet Sauvignon Malbec 2023 ,Argentina,Cabernet Franc-based blend,Unique Argentine Red Blend,,3 Reviews,$23.99 per bottle,12 bottles - $287.88,,,
Il Sorriso 2024 ,Italy,Lucido,Authentic Sicilian White,,7 Reviews,$17.99 per bottle,12 bottles - $215.88,,,
Touché William Knuttel Cabernet Sauvignon Reserve 2021 ,United States,Cabernet Sauvignon,"Luxe, Gold-Medal Napa Cabernet Reserve",,4 Reviews,$59.99 per bottle,12 bottles - $719.88,,,
Paterson Point Chardonnay 2020 ,United States,Chardonnay,95-Point Sonoma Chardonnay,,7 Reviews,$29.99 per bottle,12 bottles - $359.88,,,
Villa Blue Albariño 2024 ,South Africa,Albariño,Top-Estate Albariño,,9 Reviews,$21.99 per bottle,12 bottles - $263.88,,,
A Christmas Carol Lodi Red Blend 2021 ,United States,Red blend,Holly Jolly Lodi Red,,6 Reviews,$18.99 per bottle,12 bottles - $227.88,,,
Beach Pass Paso Robles Rosé 2020 ,United States,Rosé blend,Acclaimed California Rosé,,11 Reviews,$16.99 per bottle,12 bottles - $203.88,,,
Vinha do Fava Reserva 2023 ,Portugal,Castelão-based blend,Top-Estate Portuguese Reserva,,34 Reviews,$24.99 per bottle,12 bottles - $299.88,$299.88,$227.88,Save $72.00
GFF Chardonnay 2023 ,United States,Chardonnay,Elegant California Chardonnay,,75 Reviews,$18.99 per bottle,12 bottles - $227.88,,,
Château Le Coin Sauvignon Gris 2024 ,France,Sauvignon Gris,Elegant White Bordeaux,,146 Reviews,$22.99 per bottle,12 bottles - $275.88,$275.88,$191.88,Save $84.00
Jean-Pierre Moueix Bordeaux 2020 ,France,Merlot,Big-Name 2020 Bordeaux,,135 Reviews,$29.99 per bottle,12 bottles - $359.88,,,
L'Epiphanie de Sauternes Trio  ,,,Top-Secret Sauternes—Save $20 on Three,,,,3 bottles - $119.97,$119.97,$99.97,Save $20.00
Domaine de Longuet Merlot 2024 ,France,Merlot,Juicy Southern French Merlot,,,$19.99 per bottle,12 bottles - $239.88,,,
La Scelta Sangiovese Bianco 2023 ,Italy,Sangiovese,Rare White Sangiovese,,,$19.99 per bottle,12 bottles - $239.88,,,
Buil y Giné Priorat 2021 ,Spain,Garnacha-based blend,Top-Secret Priorat Tempranillo,,,$44.99 per bottle,12 bottles - $539.88,,,
M. Dutron Pouilly-Fuissé Vieilles Vignes 2023 ,France,Chardonnay,Fine White Burgundy,,,$49.99 per bottle,12 bottles - $599.88,,,
Hollywood Legends Cabernet Sauvignon 2021 ,United States,Cabernet Sauvignon,Bombshell California Cabernet,,3 Reviews,$19.99 per bottle,12 bottles - $239.88,,,
Champagne Nicolo & Paradis Brut NV ,France,Pinot Noir-based blend,Boutique Champagne Discovery,,,$49.99 per bottle,12 bottles - $599.88,,,
Schroeder Estate El Patrimonio 2021 ,Argentina,Cabernet-based blend,Ultra-Rare Patagonia Cabernet,,5 Reviews,$34.99 per bottle,12 bottles - $419.88,,,
Edouard Leiber Cuvée Prestige 2024 ,France,White blend,Family Estate’s Alsatian Cuvée,,3 Reviews,$23.99 per bottle,12 bottles - $287.88,,,
Berry and Spice Zinfandel 2020 ,United States,Zinfandel,Bold Paso Robles Zinfandel,,7 Reviews,$21.99 per bottle,12 bottles - $263.88,,,
Sartirano Figli Langhe Piemonte Nas-cetta 2023 ,Italy,Nas-cetta,Rare Piedmont White,,,$32.99 per bottle,12 bottles - $395.88,,,
Domaine de Longuet Viognier 2023 ,France,Viognier,Beautiful French Viognier,,4 Reviews,$19.99 per bottle,12 bottles - $239.88,,,
Schroeder Estate Blanco 2021 ,Argentina,White blend,Top-Estate Argentine White,,29 Reviews,$24.99 per bottle,12 bottles - $299.88,,,
RedHeads 1888 Cabernet Sauvignon 2022 ,Australia,Cabernet Sauvignon,Impressive Barossa Valley Cabernet,,21 Reviews,$39.99 per bottle,12 bottles - $479.88,,,
Château La Clarière Blanc 2022 ,France,Sauvignon-based blend,Classy White Bordeaux,,11 Reviews,$34.99 per bottle,12 bottles - $419.88,,,
Manga del Brujo 2021 ,Spain,Garnacha-based blend,94-Point Châteauneuf Rival,,210 Reviews,$26.99 per bottle,12 bottles - $323.88,,,
RedHeads Whip-Hand 2021 ,Australia,Cabernet Sauvignon,Impressive Barossa Cab,,,$49.99 per bottle,12 bottles - $599.88,,,
Altos de la Guardia Reserva Rioja 2019 ,Spain,Tempranillo,Refined Rioja Reserva,,128 Reviews,$32.99 per bottle,12 bottles - $395.88,,,
Crimson Farms Arabica Noir Trio  ,,,Coffee-Infused Dessert Wine—$15 Off Three Bottles,,,,3 bottles - $89.97,$89.97,$74.97,Save $15.00
"Fine Amarone in ""Happy Birthday"" Wood Box 2020 ",Italy,Red blend,Say “Happy Birthday” with an Iconic Amarone,,,$74.99 per bottle,12 bottles - $899.88,,,
NPR Wild Card Tannat 2024 ,United States,Tannat,Compelling California Tannat,,,$21.99 per bottle,12 bottles - $263.88,,,
¡H! Barcelona Hola Alcohol Free Sparkling NV ,Spain,Macabeo,Alcohol-Free Spanish Fizz,,,$21.99 per bottle,12 bottles - $263.88,,,
NPR Life Kit Pinot Grigio 2022 ,United States,Pinot Grigio,Rule-Breaking Pinot Grigio,,1 Review,$24.99 per bottle,12 bottles - $299.88,,,
NPR All Things Considered Cabernet Sauvignon 2022 ,United States,Cabernet-based blend,"Smooth, Washington State Cabernet",,2 Reviews,$22.99 per bottle,12 bottles - $275.88,,,
NPR Short Wave Chardonnay 2022 ,United States,Chardonnay,Unoaked California Chardonnay,,,$22.99 per bottle,12 bottles - $275.88,,,
Lost Isle Chardonnay 2023 ,United States,Chardonnay,Acclaimed California Chardonnay,,1 Review,$22.99 per bottle,12 bottles - $275.88,,,
Il Poeta Barbaresco Gaia Principe 2020 ,Italy,Nebbiolo,92-Point Cru Barbaresco,,,$44.99 per bottle,12 bottles - $539.88,,,
Paul Sorvino Cabernet Sauvignon 2021 ,United States,Cabernet Sauvignon,Big-Name California Cabernet,,5 Reviews,$24.99 per bottle,12 bottles - $299.88,,,
Rifronzoli Rosso di Toscana IGT 2021 ,Italy,Sangiovese-based blend,Ultra-Rare Super Tuscan Masterpiece,,9 Reviews,$39.99 per bottle,12 bottles - $479.88,,,
Forrest Gump Pinot Gris 2022 ,United States,Pinot Gris,Vibrant Washington Pinot Gris,,4 Reviews,$19.99 per bottle,12 bottles - $239.88,,,
Val de Cabrera 2023 ,Spain,Garnacha-based blend,Value-Driven Spanish Red,,7 Reviews,$19.99 per bottle,12 bottles - $239.88,,,
Rookery Red Zinfandel 2024 ,United States,Zinfandel,Smooth California Zinfandel,,11 Reviews,$17.99 per bottle,12 bottles - $215.88,,,
Momtazi Family Estate Pinot Noir 2018 ,United States,Pinot Noir,Oregon’s Most Singular Pinot Noir,,,$59.99 per bottle,12 bottles - $719.88,,,
La Cuadrilla de Sobreño 2022 ,Spain,Tinta de Toro,Tantalizing Spanish Red,,21 Reviews,$19.99 per bottle,12 bottles - $239.88,,,
Selva del Moro Chianti Classico Riserva 2019 ,Italy,Sangiovese-based blend,Luxe Chianti Classico Riserva,,7 Reviews,$35.99 per bottle,12 bottles - $431.88,,,
Domaine de Longuet Viognier 2024 ,France,Viognier,Beautiful French Viognier,,4 Reviews,$19.99 per bottle,12 bottles - $239.88,,,
Black Saint Peter Old Vine Zinfandel (half bottle) 2020 ,United States,Zinfandel,Award-Winning Lodi Zinfandel,,608 Reviews,$12.99 per bottle,12 bottles - $155.88,,,
Armagia Etna Rosso 2019 ,Italy,Nerello Mascalese-based blend,Barrel-Aged Sicilian Specialty,,8 Reviews,$39.99 per bottle,12 bottles - $479.88,,,
Il Poeta Barolo del Comune di Barolo 2019 ,Italy,Nebbiolo,Exquisite Barolo “Cru”,,,$54.99 per bottle,12 bottles - $659.88,,,
Shroud Mountain Cabernet Sauvignon Magnum 2021 ,United States,Cabernet Sauvignon,Best-Selling California Cab—in MAGNUM,,511 Reviews,$49.99 per bottle,12 bottles - $599.88,,,
Capital Z Zinfandel 2024 ,United States,Zinfandel,Intense Lodi Zinfandel,,222 Reviews,$16.99 per bottle,12 bottles - $203.88,,,
Château de Colombe Castillon Côtes de Bordeaux 2022 ,France,Merlot-based blend,Gold-Medal Saint-Émilion Rival,,199 Reviews,$28.99 per bottle,12 bottles - $347.88,,,
Cuvée du Vatican Réserve de l'Abbé Blanc 2024 ,France,White blend,Expressive Rhône White,,,$19.99 per bottle,12 bottles - $239.88,,,
Luciani Brunello di Montalcino 2019 ,Italy,Sangiovese,Boutique Estate's Fine Brunello,,17 Reviews,$64.99 per bottle,12 bottles - $779.88,,,
Château Sixtine Châteauneuf-du-Pape 2023 ,France,Grenache-based blend,Opulent Châteauneuf Icon,,8 Reviews,$69.99 per bottle,12 bottles - $839.88,,,
Seven5Zero Kosher Cabernet Sauvignon 2021 ,Israel,Cabernet Sauvignon,Leading Israeli Estate’s Cabernet Sauvignon,,23 Reviews,$29.99 per bottle,12 bottles - $359.88,$359.88,$287.88,Save $72.00
Sentiero dei Pini Pinot Grigio 2024 ,Italy,Pinot Grigio,Ultra-Fresh Italian Pinot Grigio,,248 Reviews,$18.99 per bottle,12 bottles - $227.88,,,
Château Smith Haut Lafitte Pessac Léognan Grand Cru Classé Rouge 2018 ,France,Cabernet-based blend,99-Point Pessac-Léognan Grand Cru Classé,,,$169.99 per bottle,12 bottles - $2039.88,,,
Il Pino Pinot Grigio 2024 ,Italy,Pinot Grigio,Refreshing Italian Pinot Grigio,,297 Reviews,$17.99 per bottle,12 bottles - $215.88,,,
Domaine Daniel Reverdy Sancerre 2023 ,France,Sauvignon Blanc,Boutique Sancerre,,33 Reviews,$39.99 per bottle,12 bottles - $479.88,,,
Schroeder Estate Cabernet Sauvignon 2024 ,Argentina,Cabernet Sauvignon,Extremely Good Cab from the Extreme South,,395 Reviews,,12 bottles - $299.88,$299.88,$227.88,Save $72.00
Tenuta Albrizzi Cabernet Sauvignon Primitivo 2023 ,Italy,Red blend,Sumptuous ‘Super Puglian’,,291 Reviews,$17.99 per bottle,12 bottles - $215.88,,,
"Inside Track Chardonnay 2024, Margaret River Trio  ",,,Exquisite Australian Chardonnay—Save 50%,,,,3 bottles - $209.97,$209.97,$104.97,Save $105.00
Beautiful Rose Prosecco Gift Trio  ,,,The Perfect Present for Prosecco Fans,,,,3 bottles - $70.97,$70.97,$59.99,Save $10.98
"Napa Cab Reserve in 'Congratulations"" Wood Box NV ",United States,Cabernet Sauvignon,This Napa Cab Calls for a Celebration,,,$74.99 per bottle,12 bottles - $899.88,,,
Domare Barbera 2023 ,Italy,Barbera,Silky Piedmont Red,,2 Reviews,$21.99 per bottle,12 bottles - $263.88,,,
Père Guillot Sablet 2022 ,France,Grenache-based blend,The Rhône’s Hidden Gem,,,$26.99 per bottle,12 bottles - $323.88,,,
Palumbo Falanghina 2023 ,Italy,Falanghina,Delightful New Falanghina,,,$15.99 per bottle,12 bottles - $191.88,,,
Bloom & Bounty Chardonnay 2023 ,United States,Chardonnay,Rich California Chardonnay,,4 Reviews,$19.99 per bottle,12 bottles - $239.88,,,
Lobo e Falcão Branco 2022 ,Portugal,Fernão Pires-based blend,"Acclaimed, Top-Estate Portuguese White",,9 Reviews,$16.99 per bottle,12 bottles - $203.88,,,
East West Red Wine 2023 ,United States,Red blend,Acclaimed California Red,,17 Reviews,$17.99 per bottle,12 bottles - $215.88,,,
Les Pépites 2024 ,France,Malbec-based blend,Venerated French Malbec Blend,,9 Reviews,$22.99 per bottle,12 bottles - $275.88,,,
Bottle Poem Pinot Noir 2024 ,United States,Pinot Noir,Silky California Pinot Noir,,63 Reviews,$21.99 per bottle,12 bottles - $263.88,,,
Lustrato Prosecco  ,Italy,Glera,Celebration-Worthy Prosecco,,1 Review,$18.99 per bottle,12 bottles - $227.88,,,
Airplane Chardonnay 2020 ,United States,Chardonnay,High-Flying California Chardonnay,,5 Reviews,$17.99 per bottle,12 bottles - $215.88,,,
Hacienda del Arte Reserva Ribera del Duero 2016 ,Spain,Tempranillo,Rare Ribera Reserva,,,$32.99 per bottle,12 bottles - $395.88,,,
Guyendac 2023 ,France,Sauvignon Blanc,White Bergerac that Overdelivers,,44 Reviews,$19.99 per bottle,12 bottles - $239.88,,,
Cooper Point Merlot 2023 ,United States,Merlot,Plush California Merlot,,37 Reviews,$18.99 per bottle,12 bottles - $227.88,,,
Vigné-Lourac Gaillac Les Perlés 2023 ,France,White blend,Luxurious French White,,29 Reviews,$21.99 per bottle,12 bottles - $263.88,,,
RedHeads Night Of The Living Red 2022 ,Australia,Durif-based blend,"Handcrafted, Top-Estate Australian Red",,7 Reviews,$39.99 per bottle,12 bottles - $479.88,,,
Asado Malbec 2024 ,Argentina,Malbec,BBQ-Ready Argentine Malbec,,137 Reviews,$19.99 per bottle,12 bottles - $239.88,,,
Leonardo Palumbo Thank You Deal  ,,,Rich Reds from an Italian Legend—Over 20% Off,,,,6 bottles - $107.94,$107.94,$83.94,Save $24.00
Cuvée Prestige Trio  ,,,Fine White from an Alsace Icon—25% Off,,,,3 bottles - $71.97,$71.97,$53.97,Save $18.00
Le Vieux Château Guibeau 2022 ,France,Merlot-based blend,Boutique Saint-Émilion,,,$34.99 per bottle,12 bottles - $419.88,,,
